[
  {
    "decision_id": "E256-C01",
    "epic_row": "3 / RFC-039 Phase A",
    "task_refs": ["srs#242", "srs#306", "RFC-039"],
    "decision_family": "C",
    "title": "Use authored Field names as Record value keys",
    "decision_statement": "The revision-2 Record carrier will store fieldValues as an object keyed verbatim by Field.name, with field identity recovered through the Record's version-pinned Type rather than repeated as a fieldId in each value.",
    "status": "ratified",
    "decision_class": "precedent-setting",
    "effective_date": "2026-07-31",
    "sources": [
      {
        "kind": "rfc",
        "authority_rank": 2,
        "url_or_path": "https://github.com/the-greenman/srs/blob/e0fb4b050447febcd5ecb8f6ccb7864196e656d6/rfcs/rfc-039-record-field-value-carrier.md#change-a--fieldvalues-becomes-an-object-keyed-by-fieldname",
        "excerpt": "Accepted RFC-039 Change A specifies verbatim Field.name keys, no case or separator transform, and Type-mediated recovery of fieldId.",
        "explicitness": "explicit",
        "commit_sha": "e0fb4b050447febcd5ecb8f6ccb7864196e656d6"
      },
      {
        "kind": "pull-request",
        "authority_rank": 2,
        "url_or_path": "https://github.com/the-greenman/srs/pull/306",
        "excerpt": "PR 306 merged the Accepted Revision 6 RFC design at 2026-07-31T22:10:00Z; it did not perform Phase B.",
        "explicitness": "explicit",
        "commit_sha": "e0fb4b050447febcd5ecb8f6ccb7864196e656d6"
      }
    ],
    "alternatives": ["Keep the UUID-keyed FieldValue array.", "Key the object by field UUID.", "Transform authored names to lowerCamelCase.", "Add a separate fieldId map to each Type."],
    "accepted_cost": "Readable keys become load-bearing within a pinned Type version; stored write order and per-entry UUID redundancy disappear, and the ecosystem requires an atomic migration.",
    "supersedes": ["Record.fieldValues as FieldValue[]", "RFC-035 R4 when read as applying lowerCamelCase to domain Types"],
    "derived_from": ["RFC-032 fieldType", "RFC-035 projectField"],
    "axes": {
      "integrity_expression": {
        "relevance": "decisive", "direction": "expression", "evidence_basis": "revealed-by-alternative", "confidence": "high",
        "counterfactual": "UUID keys would preserve rename-independent identity in each instance but remain opaque to people and standard schema tools.",
        "counterpole_safeguard": "Field identity remains resolvable through typeId, typeVersion, and effective-set name uniqueness.",
        "shadow_signal": "Names are treated as durable identity without pinned Type versions or explicit rename migration."
      },
      "continuity_evolution": {
        "relevance": "decisive", "direction": "evolution", "evidence_basis": "explicit", "confidence": "high",
        "counterfactual": "Retaining the wrapper array would preserve compatibility but keep the schema and instance representations structurally misaligned.",
        "counterpole_safeguard": "The accepted RFC requires a gated, exhaustive, atomic Phase-B migration and preserves the old form until then.",
        "shadow_signal": "A breaking carrier shape lands in only part of the ecosystem."
      },
      "coherence_autonomy": {
        "relevance": "decisive", "direction": "coherence", "evidence_basis": "explicit", "confidence": "high",
        "counterfactual": "Different keys for schemas and instances would require a permanent bridge and permit semantic drift.",
        "counterpole_safeguard": "Domain packages author their own names verbatim; uniqueness is scoped to one Type's effective field set.",
        "shadow_signal": "Cross-layer alignment expands into a global naming authority over unrelated packages."
      }
    },
    "cube": {"dimensionality": "vertex", "coordinate": ["Expression", "Evolution", "Coherence"]},
    "exception_class": "none",
    "review_state": "calibrated",
    "coding_notes": "Phase A ratified the design only. The current canonical record.json at the frozen snapshot still contains the legacy array, so this is not coded implemented. This card overlaps calibrated pilot E256-C90 and should replace, not duplicate, it during reconciliation."
  },
  {
    "decision_id": "E256-C02",
    "epic_row": "3 / RFC-039 Phase A",
    "task_refs": ["srs#242", "srs#306", "RFC-039"],
    "decision_family": "C",
    "title": "Make the carrier recursively identical to the projected field value space",
    "decision_statement": "A Record value is determined solely by its Field.fieldType, with list cardinality uniformly array-wrapping the scalar, inline-reference, reference, map, or dependent shape; inline composites recursively contain the same fieldValues map.",
    "status": "ratified",
    "decision_class": "precedent-setting",
    "effective_date": "2026-07-31",
    "sources": [{
      "kind": "rfc", "authority_rank": 2,
      "url_or_path": "https://github.com/the-greenman/srs/blob/e0fb4b050447febcd5ecb8f6ccb7864196e656d6/rfcs/rfc-039-record-field-value-carrier.md#change-b--one-recursive-value-rule-identical-to-projectfields-instance-space",
      "excerpt": "Change B makes instance shape and projectField the same rule read in two directions, including recursive inline composites and a uniform list wrap.",
      "explicitness": "explicit", "commit_sha": "e0fb4b050447febcd5ecb8f6ccb7864196e656d6"
    }],
    "alternatives": ["Define a second carrier-specific value grammar.", "Retain FieldGroup/groupValues for nested values.", "Use an untyped JSON escape hatch for composites."],
    "accepted_cost": "The migration and validators must implement recursion, exact facet defaults, and every schema-legal branch rather than treating composite values as opaque JSON.",
    "supersedes": ["Separate instance shapes for scalar, repeatable, and grouped values"],
    "derived_from": ["RFC-032 Change G", "RFC-035 projectField"],
    "axes": {
      "integrity_expression": {
        "relevance": "decisive", "direction": "integrity", "evidence_basis": "explicit", "confidence": "high",
        "counterfactual": "A separate or untyped carrier could accept values whose meaning differs from the Type's projected schema.",
        "counterpole_safeguard": "The result is directly consumable by ordinary JSON Schema tooling and readable as normal JSON.",
        "shadow_signal": "Recursive typing becomes too complex for practical authoring or ordinary validators."
      },
      "continuity_evolution": {
        "relevance": "decisive", "direction": "evolution", "evidence_basis": "explicit", "confidence": "high",
        "counterfactual": "Preserving separate legacy carriers would leave composite range uncarried and cardinality duplicated.",
        "counterpole_safeguard": "Phase B must prove full-corpus logical round trips before changing effective data.",
        "shadow_signal": "The model is simplified before all legacy branches have a total disposition."
      },
      "coherence_autonomy": {
        "relevance": "decisive", "direction": "coherence", "evidence_basis": "explicit", "confidence": "high",
        "counterfactual": "Carrier and projection implementations could encode the same Field differently.",
        "counterpole_safeguard": "Implementations retain freedom in how they realize the shared recursive contract.",
        "shadow_signal": "One target's limits are mistaken for the universal semantic value space."
      }
    },
    "cube": {"dimensionality": "vertex", "coordinate": ["Integrity", "Evolution", "Coherence"]},
    "exception_class": "none", "review_state": "uncalibrated",
    "coding_notes": "The recursive shape is independently reversible from the choice of object key and from null handling, which are separate cards."
  },
  {
    "decision_id": "E256-C03",
    "epic_row": "3 / RFC-039 Phase A",
    "task_refs": ["srs#242", "srs#306", "RFC-039"],
    "decision_family": "C",
    "title": "Relocate per-value provenance without wrapping domain values",
    "decision_statement": "Per-value source, editedAt, and sourceRefs move losslessly to an optional fieldMeta sibling keyed like fieldValues; provenance remains field-scoped, not record-scoped or per-list-element, so domain values stay directly schema-valid.",
    "status": "ratified", "decision_class": "precedent-setting", "effective_date": "2026-07-31",
    "sources": [{
      "kind": "rfc", "authority_rank": 2,
      "url_or_path": "https://github.com/the-greenman/srs/blob/e0fb4b050447febcd5ecb8f6ccb7864196e656d6/rfcs/rfc-039-record-field-value-carrier.md#change-c--per-value-provenance-moves-to-a-parallel-fieldmeta-sibling",
      "excerpt": "Change C rejects wrappers, record-level reinterpretation, and deletion, and preserves the three provenance facets in a parallel fieldMeta object.",
      "explicitness": "explicit", "commit_sha": "e0fb4b050447febcd5ecb8f6ccb7864196e656d6"
    }],
    "alternatives": ["Wrap each value in a value-plus-metadata object.", "Move all provenance to Record level.", "Delete the sparsely used per-value capability."],
    "accepted_cost": "A parallel object and key-coherence rule are added for a capability used by only one measured value, while per-item and nested provenance granularity are not retained.",
    "supersedes": ["Metadata embedded in FieldValue wrappers"],
    "derived_from": ["RFC-017 sourceRefs capability", "RFC-039 name-keyed carrier"],
    "axes": {
      "integrity_expression": {
        "relevance": "decisive", "direction": "integrity", "evidence_basis": "revealed-by-alternative", "confidence": "high",
        "counterfactual": "Moving or deleting field-scoped provenance would change the claim's meaning; wrapping would make schemas describe envelopes rather than domain values.",
        "counterpole_safeguard": "Ordinary domain values remain direct and usable; the uncommon metadata object is optional.",
        "shadow_signal": "Sparse future capability adds persistent structural complexity without exercised value."
      },